etapa,providencia,area,enquadramento,objetivos,ficha_tecnica,situacao,outras_fontes,acessibilidade,sinopse,nome,cgccpf,mecanismo,segmento,PRONAC,estrategia_execucao,valor_aprovado,justificativa,resumo,valor_solicitado,especificacao_tecnica,municipio,data_termino,UF,impacto_ambiental,democratizacao,valor_projeto,proponente,ano_projeto,data_inicio,valor_captado,valor_proposta
"Este projeto será dividido nas seguintes etapas: Etapa 1 - (Março de 2019) - Captação do recurso para financiar a proposta; Etapa 2 - (Março de 2019) - Criação do material gráfico, encarte, capa do","Projeto aprovado e publicado no Diário Oficial da União.","Música","Artigo 26","A banda Hylidae tem como objetivo fomentar e diversificar a cultura na região Amazônica, e para que isso ocorra contamos com a aprovação deste projeto para que a banda possa entrar em estúdio e gravar","O proponente deste projeto será o responsável pela gestão administrativa / técnico-financeira durante toda a execução do mesmo, deixando a cargo da Associação dos Músicos do Acre (AMAC) toda a produçã","Autorizada a captação total dos recursos",0.0,"A acessibilidade aos portadores de necessidades especiais será garantida pela distribuição gratuita com 10% dos CDs em centros culturais.","O Cd Ritual tem suas letras voltadas em ritos indígenas e também voltadas a rituais os quais impactaram o mundo mostrando o lado sujo e sombrio dos seres humanos e sua ambição pelo poder.","Ritual","***006532**","Mecenato","Música Popular Cantada","186288","Vale ser lembrado que a banda Hylidae reside no extremo norte do país (Acre), que além das dificuldades encontradas pela distância dos grandes centros no Brasil a banda busca incansavelmente por seu e",87406.0,"A diversidade cultural do cenário acreano permite inúmeras manifestações da liberdade de expressão que a música pode proporcionar. Dentre os mais variados estilos e ritmos, o Heavy Metal se destaca pe","Este projeto destina-se a gravação do CD intitulçado Ritual da banda de heavy metal acreana Hylidae, contendo 10 faixas inéditas de sua autoria. Serão feitas 2.000 (duas mil) cópias do disco.",87406.0,"O produto a ser lançado pela banda serão 2.000 (duas mil) cópias do CD intitulado Ritual da banda Hylidae contendo 10 músicas e no encarte tendo todas as letras e fotos dos integrandes e ficha técni","Rio Branco","2019-06-07","AC","","Hoje a mídia alternativa (internet) vem sendo um dos principais meios de comunicação no mundo, superando até mesmo as rádios e televisões, com isso a banda Hylidae após o lançamento do disco Ritual,",87406.0,"Roberto Padula Ribeiro De Castro","18","2019-03-04",0.0,87406.0
"Pré Produção – 30 dias -Contratação da estrutura; -Gestão da programação; -Gestão dos patrocínios; -Contratação de, palcos, vigilância e informações, carga e descarga, controle de transito; -Cont","Projeto aprovado e publicado no Diário Oficial da União.","Música","Artigo 26","Objetivo Geral: Realizar a gravação do DVD e turnê da Cantora Jéssica Rodrigues, no intuito de estimular o interesse pela música, o projeto visa 2 dias de apresentações para divulgação do DVD nas Cid","GRAVOMIX - COORDENADOR DO PROJETO PORTIFÓLIO 2016 - 2018 A Empresa com sua estrutura projetada para receber artistas de grande porte, e projetos de gravações de DVDs, elaboração de Show e turnê,","Autorizada a captação total dos recursos",0.0,"A escolha dos locais de realização das atividades terá condições de acesso para pessoas portadoras de necessidades especiais, idosos e pessoas com dificuldade de locomoção,. Ainda monitores serão disp","O repertório musical será elaborado e preparado pelo Artista e equipe de podução, asim que concluído nos comprometemos a anexar no projeto.","DVD e Turnê Jéssica Rodrigues ","05969002000107","Mecenato","Música Popular Cantada","186287","O proponente será remunerado pelo item Coordenador do Projeto.",1498721.41,"Este projeto se justifica ainda por fomentar a discussão acerca da musica, sua identidade, sua importância e sua riqueza sonora dentro do cenário musical nacional, A solicitação de apoio ao projeto j","O projeto tem como objetivo realizar a gravação do DVD da Cantora Jéssica Rodrigues, e a realização de 2 shows para divulgação de seu trabalho.",1498721.41,"não se aplica","Belo Horizonte","2019-09-12","MG","","Medidas que serão dotadas pelo projeto referente ao produto DVD Todos os DVD´s serão distribuidos grauitamente I - doar, além do previsto no inciso I, do art. 44, do Decreto 5.761, de 2006, no mínim",1498721.41,"GRAVOMIX PRODUCOES ARTISTICAS EIRELI","18","2019-04-12",0.0,1498721.41
"PRÉ-PRODUÇÃO – 15 DIAS Planejmanto das apresentações e calendário Contato com os profissionais, fornecedores e músicos Contrato de locação de materiais, equipamentos e locais de realização dos show","Projeto aprovado e publicado no Diário Oficial da União.","Música","Artigo 26","OBJETIVO GERAL - Circular com o Show Clareza por oito cidades da região metropolitana e interior do Rio Grande do Sul.   OBJETIVOS ESPECÍFICOS - Atingir um público de aproximadamente 2 mil e 400 p","PROPONENTE: LEANDRO BERTOLO KAUSCH  VOZ / VIOLÃO Compositor, intérprete e violonista. Trabalha com MPB genuína, embora tramite em vários gêneros musicais. Como músico da noite, percorreu, desde a","Autorizada a captação total dos recursos",0.0,"Teremos o cuidado de escolher os locais de realização das apresentações que tenham medidas de acessibilidade. Teremos espaços na frente reservados para idosos e PNE. Será produzida uma cartilha com d","O álbum Clareza marca a estreia profissional em disco de Leandro Bertolo no cenário da MPB. A canção-título, de autoria de Álvaro Hoff, pontua a decisão de Leandro, intérprete de canções populares dos grandes nomes da música brasileira, a buscar a sua própria escritura como cantor e compositor. “Clareza de ideias, clareza de sentimentos para materializar um trabalho autoral”, ressalta o artista, que por muitos anos atuou na noite porto-alegrense. A aceitação por parte da crítica foi unânime: “Clareza” recebeu 4 indicações para o Prêmio Açorianos de Música 2017, concedido pela Prefeitura de Porto Alegre: Melhor Intérprete; Melhor Compositor para Leandro Bertolo; Melhor Compositor para Elias Barboza; Disco do Ano. Trata-se da mais importante distinção concedida à música e aos músicos no Rio Grande do Sul. As cançõesUm músico da noite precisa trabalhar vários estilos. Precisa ser eclético, ter um acervo variado, que agrade ao público. O disco Clareza, do cantor rememora a época em que se apresentava em bares da Cidade Baixa, de Porto Alegre, e, como tal, contempla vários gêneros musicais, como a valsa, a MPB, a seresta, mas é o samba que se impõe em suas últiplas vertentes.","Show Musical Clareza","***222460**","Mecenato","Música Popular Cantada","186286","Outros artistas que farão parte das apresentações.   SILFARNEI DA SILVA ALVES - VIOLÃO Músico profissional de Porto Alegre desde 1983, violonista, compositor, acompanhando cantores e músicos como:",327980.49,"“A importância da Música Popular Brasileira no cenário de nossa cultura é inegável. Pode-se constatar que a MPB, além de sua relevância como manifestação estética tradutora de nossas múltiplas identid","O projeto “Show Musical Clareza” pretende realizar oito apresentações musicais inspirados no álbum “Clareza”. O espetáculo contempla a apresentação das 12 faixas do álbum de gênero MPB, além de outras músicas. As apresentações ocorrerão no interior do estado, nas cidades de São Leopoldo, Caxias do Sul, Gramado, Barra do Ribeiro, Pelotas, Capão da Canoa, Santa Maria, e Santa Cruz do Sul no Rio Grande do Sul.",327980.49,"As apresentações tem em torno de 1:30h 1:45h de tempo.","Porto Alegre","2019-07-31","RS","","Os ingressos das apresentações serão vendidos nos locais de realização das apresentações e online. Serão disponibilizado, conforme plano de distribuição, ingressos de meia entrada e distribuição grat",327980.49,"LEANDRO BERTOLO KANSCH","18","2019-05-01",0.0,327980.49
"Pré-produção – 3 meses - Captação de recursos (podendo durar todo o andamento do projeto); - Planejamento executivo; - Criação de material para divulgação. Produção – 7 meses - Realização da divu","Projeto aprovado e publicado no Diário Oficial da União.","Música","Artigo 26","Objetivos Gerais:  Se trata da gravação do primeiro DVD da carreira do jovem Jonathan Brito (Jonn), a gravação do DVD na vida de um artista pode ser considerada como um novo tempo, o começo de uma ca","Alan Fernandes - Diretor geral e Proponente Produtor Artístico | Curso de Assessoria de Comunicação Musical Jornalista Patrícia Spínola – 2010. Marketiing Digital: Mídias Sociais, Fiap – 2014. Cinema","Autorizada a captação total dos recursos",0.0,"PRODUTO: DVD  Acessibilidade de Conteúdo: O DVD produzido pelo projeto contará com legendas em português a fim de atender pessoas com deficiência auditiva e audiodescrição para promover acesso a pess","Músicas: Quero Amar (Cecéu Muniz), Tão Natural (Valtinho Jota), Luz do Sol (Nettinho Tembra/Wagner Gama), Deixa Rolar (Allan Lima), Sem teu amor (Billy SP/Isabeh),Como a minha vida vai ficar (André Lemmos), Nosso tempo Já Passou (Rodrigo Oliveira, Éder luiz, Lallas), Na trilha do amor (Jonn).","Gravação DVD - Jonn","***113738**","Mecenato","Música Popular Cantada","186285","Não se aplica.",453630.38,"A importância da Música Popular Brasileira no cenário de nossa cultura é inegável é além de sua relevância como manifestação estética tradutora de nossas múltiplas identidades culturais, apresenta-se","O presente projeto pretende realizar apresentação musical e gravação de um DVD intitulado DVD John.",453630.38,"Resposta à diligência:  Ao contrário do que o parecerista informou, esta é sim de fato a primeira proposta do proponente, portanto, o mesmo está resguardado pelo § 1º do art. 2 da Instrução Normativa","Diadema","2020-02-26","SP","","Referente à distribuição gratuita à população, adotaremos o exposto no item a, inciso I do artigo 20 da IN no 05/2017 do MinC para a doação gratuita de 10% do total de produtos, a saber: a) mínimo",453630.38,"Alan Humberto Fernandes","18","2019-02-26",0.0,453630.38
"Pré-Produção: O trabalho de mapear esses terreiros já foi iniciado, sendo que com uma estrutura que não dá alcance a todos, logo precisamos desse incentivo para começar a estruturar. 1 - Sistema Int","Projeto aprovado e publicado no Diário Oficial da União.","Museus e Memória","Artigo 18","Objetivo Geral: O Cadastro Único de Barracões tem por principal objetivo resgatar as casas que seguem o conceito religioso de matriz africana, com isso traremos a tona uma cultura que aos pouco vem s","O processo de mapeamento é dividivo em: 1 - Implementação de sistema integrado 2 - Preparo dos colaboradores que farão o preenchimento dos cadastro 3 - Organização de materiais necessário para o in","Autorizada a captação total dos recursos",0.0,"Pesquisa: O processo de mapeamento se dá com a visita as casas de matrizes africanas para um levantamento de informações, logo o acesso será concedido ao Centro de Referência de Matrizes Africanas, n","O conteúdo do mapeamento se resume a: 1 - Ficha Cadastral 2 - Sistema integrado 3 - Site para inclusão das informações coletadas","Cadastro Único de Barracões","***732067**","Mecenato","Pesquisa","186284","O projeto não se trata de um espetáculo, filme, ou apresentação, mas tem uma importância tão grande ou maior que esses citado, pois estamos tentando estrutura uma parte da cultura brasileira que não t",312715.7,"Art. 1 - I, II, III, IV, V, VIII. Porque a Lei Rouanet com seu incentivo financeiro torna possível legitimar as casas que de terreiro que perduram a cultura afro brasileira, fazendo com que essa part","O Cadastro Único de Barracões é um trabalho que já vem sendo realizado pelo Centro de Referência de Matrizes Africanas, uma instituição ainda não registrada, mas que promove como sociedade civil o resgate da cultura dos povos de matrizes africanas no âmbito religioso e social, o Cadasrtro Único de barracões é um mapeamento dos terreiros, tem como objetivo dar visibilidade a religião e a cultura existente nesse conceito religioso que é um fundador da nossa nação e em grande parte construtor da cultura alimintar, musical e folclórica do nosso país, que vem se perdendo pelo fato dos atos de intolerência religiosa e racial, com esse trabalho poderemos reafirmar as raizes culturais formadoras dessa grande nação chamada Brasil. Trata-se de uma pesquisa para preservação de patrimonio imaterial, que é a nossa história cultural.",312715.7,"","São Gonçalo","2020-03-04","RJ","","O mapeamento por si só é o produto da democratização de acesso, esse projeto vem em prol de gerar visibilidade a um povo que é descriminado, pelo simples fato de o orgão governamental que faz o Censo",312715.7,"Juraciara Marta Mões","18","2019-03-04",0.0,312715.7
"PRÉ‐PRODUÇÃO Período previsto: 2 meses (março – abril) 1)      Escrever as estórias 2)      Compor as músicas 3)      Produtor musical inicia o trabalho 4)      Produtor musical arranja as músi","Projeto aprovado e publicado no Diário Oficial da União.","Humanidades","Artigo 18","A voz é o primeiro contato da criança com o exterior. Desde o momento em que nasce, é a fala do outro que começa a dar significação à sua chegada ao mundo. Isso nos permite afirmar que a voz é o prime","Concepção de parte das obras, supervisão geral e contratação dos serviços previstos na planilha orçamentária serão realizadas pelo proponente, ficando eu (Joyce reichert Carnassale Vital), após a prim","Autorizada a captação total dos recursos",0.0,"(em atendimento ao Art. 47 da Instrução Normativa nº 01/2017 do MinC). No que se refere às pessoas portadoras de deficiências e necessidades especiais é de conhecimento do proponente  que o local a s","A obra “Bebê Feliz - Hora do Sono” é uma obra literária e fonográfica que tem como principal objetivo estreitar as relações entre pais e seus filhos, uma vez que a sugestão é que ele seja lido e explorado nos momentos que antecedem o sono dos bebês. O texto trará descrições de hábitos de sono de alguns animais e dos bebês, adicionando componentes afetivos que tragam segurança e a sensação de proteção aos bebês enquanto dormem. Os animais, arara azul, calopsita, cão dálmata, gato e ovelha, serão retratados na sua hora do sono, com seus hábitos peculiares, sempre lembrando que são cuidados e protegidos por Deus.Objetivamos que pais separem momentos especiais de convivência com seus filhos para transmitirem conteúdos relevantes e demonstrarem proteção e amor aos seus bebês.Para os bebês desejamos que o contato com hábitos de sono dos animais desperte a consciência de preservação e cuidado com o meio ambiente. Mostrar que animais têm hábitos semelhantes e diferentes do ser humano objetiva a percepção de proximidade do homem com os animais. Observar que Deus protege a todas as criaturas deve trazer paz e segurança aos bebês.","Bebê Feliz – Hora do Sono","***791718**","Mecenato","Livros  ou obras de referência - valor Literário","186283","O proponente será remunerado nos seguintes itens: Coordenação do projeto;Direito autoral das canções;Compositor;Direção musical;Cantor / Solista;Elaboração de prestação de contas   Os direitos auto",248076.68,"Hoje vivemos num mundo onde o digital é cada vez mais presente. Nossas crianças já nascem com um post nas redes sociais, com um ipad nas mãos, um celular na mesa do almoço. Cada vez mais me parece que","Trata-se de um livro para bebês com 7 estórias acompanhado de um cd com 7 músicas. Este livro conterá ilustrações que promovam a experiência tátil (texturizadas) acompanhadas de pequeninos textos que incentivam o momento do sono. As faixas musicais estarão disponíveis também no formato QR code.",248076.68,"LIVRO/CD  Bebê Feliz - A criação do mundo   PRÉ IMPRESSÃO: Provas digitais e Mocape IMPRESSÃO:  4 x 4 cores PAPEL MIOLO: Cartão Duplex Art Kot 250g - Cartão Horle n⁰ 22 PAPEL CAPA: 4x0 cores em","São Paulo","2019-10-31","SP","","Os livros serão vendidos a preço popular, atendendo o artigo tornar os preços de comercialização de obras ou de ingressos mais acessíveis à população em geral’. (Decreto nº 5.761/2006). Está previsto",248076.68,"JOYCE REICHERT CARNASSALE VITAL","18","2019-03-01",0.0,248076.68
"CRONOGRAMA PRÉ-PRODUÇÃO: 4 meses - Elaboração do projeto para os patrocinadores - Contratar equipes de pré-produção e produção - Busca de parceiros e patrocinadores - Contratar designer gráfico, mo","Projeto aprovado e publicado no Diário Oficial da União.","Música","Artigo 18","Objetivo Principal: O principal objetivo do festival é colocar o público em contato com variadas formas de expressão artística às quais o público do interior tem pouco acesso (música instrumental, óp","*Gleizer Corrêa Naves - Diretor Geral e Proponente (Rubrica Diretor Geral) Função no projeto: Supervisão geral do projeto, contato direto com patrocinadores, prefeituras, aprovação e gerenciamento fi","Autorizada a captação total dos recursos",0.0,"Em todos os locais a produção dos eventos colocará à disposição lugares especiais e reservados aos portadores de necessidades especiais e idosos. A equipe do festival prestará assistência, inclusive i","","10º Festival Nacional da Cultura","05950230000135","Mecenato","Música Instrumental","186282","",1077352.65,"Ao apoiar o 10º Festival Nacional da Cultura, o Ministério da Cultura, através da Lei Rouanet, estará contribuindo para fomentar a cultura brasileira e, também dar oportunidade ao público do interior","Realização do 10º Festival Nacional da Cultura com apresentações de música instrumental, ópera, teatro, circo e dança no interior de Minas. O evento é gratuito, realizado em espaços abertos e atinge a todas as esferas sociais.",1077352.65,"","Boa Esperança","2020-03-04","MG","","Incisos do art. 21 da IN nº 05/2017 do MinC as quais o 10º Festival Nacional da Cultura está comprometido III - disponibilizar, na Internet, registros audiovisuais dos espetáculos, das exposições, da",1077352.65,"FENAC PROMOCOES E EVENTOS LTDA - EPP ","18","2019-03-04",0.0,1077352.65
"ETAPAS: 1 - Planejamento e gestão executiva (4 meses) ·         Ações de coordenação geral e de planejamento e gestão; ·         Ações de articulação institucional e captação de recursos; ·","Projeto aprovado e publicado no Diário Oficial da União.","Música","Artigo 18","OBJETIVO GERAL: Realizar a segunda edição do evento “Panela do Jazz – Festival de Música Instrumental do Poço da Panela” que irá reunir grandes nomes da música instrumental de Pernambuco e da cena na","Pro4 - Promoções &amp; Eventos - Direção Geral / Gestão Administrativo-financeira A PRO4 é uma empresa especializada em marketing cultural, há 2 anos atuando em organização, planejamento, produção ex","Autorizada a captação total dos recursos",0.0,"Todas as instalações e locais do festival terão obrigatoriamente acesso especial para idosos, portadores  deficiências visuais, auditivas e de outras necessidades especiais, além de assentos e espaços","O evento contará com a realização de seis (6) shows gratuitos, a acontecer no Pátio Público da Igreja da Nossa Senhora da Saúde do Poço da Panela, das 14:00 às 23:00 no mês de maio de 2019. No período do evento, ocorrerá a Feira Livre do Poço, já a partir das 11:00h, uma feira cultural onde se destaca os estandes que abrigarão artesanato, gastronomia e materiais produzidos através da economia criativa de mulheres da comunidade do Poço da Panela e Organizações da Sociedade Civil. Todo o evento é de acesso gratuito e classificação livre para a população em geral. O Festival Panela do Jazz promoverá um verdadeiro encontro da música instrumental, transformando o bairro no reduto do Jazz pernambucano. Entre as apresentações, tanto na Feira como no local de apresentação musical, a comissão organizadora abrirá momentos de reflexão e debates sobre a importância da valorização da nossa identidade cultural, da preservação do nosso Rio Capibaribe, o resgate da história sociocultural do bairro e as influências do Jazz na música instrumental de Pernambuco. Também serão oferecidos 02 (dois) Workshops, sendo 01 (um) de gestão cultural e 01 (um) de economia criativa; 02 (dois) Masterclass de música, sendo 01(um) percepção musical e 01 (um) de criatividade musical. 01 (uma) vivência ambiental nas margens do Rio Capibaribe – visão e percepção do ecossistema e impactos ambientais ocorridos ao longo do tempo, tendo como público prioritário para as ações formativas os alunos da rede pública de ensino. ESPECIFICAÇÕES TÉCNICAS O projeto consiste na realização de: ·         06 (seis) shows gratuitos de música instrumental com o foco nos artistas locais (pernambucanos) e atrações renomadas do ramo do Jazz nacional. Os shows terão uma duração de até uma hora e meia (01h30min) com trinta minutos (30 min) para a rodagem de palco. ·         02 (dois) Workshops, sendo 01 (um) de gestão cultural e 01 (um) de economia criativa; 02 (dois) Masterclass de música, sendo 01(um) percepção musical e 01 (um) de criatividade musical e 01 (uma) vivência ambiental nas margens do Rio Capibaribe – visão e percepção do ecossistema e impactos ambientais ocorridos ao longo do tempo.","Panela do Jazz - Festival de Música Instrumental do Poço da Panela","13359091000106","Mecenato","Música Instrumental","186281","METODOLOGIA / ESTRATÉGIA DE AÇÃO: Por ser um festival de música instrumental com uma proposta de educação não-formal, é importante considerar o perfil, necessidades e a realidade cultural de cada ind",399654.97,"JUSTIFICATIVA Nascido nas comunidades negras de Nova Orleans (EUA), o Jazz é um gênero musical disseminado pelo mundo nas primeiras décadas do século XX, que modificou os parâmetros interpretativos d","O projeto visa realizar a segunda edição do “Panela do Jazz – Festival de Música Instrumental do Poço da Panela”. Acontece em maio de 2019, no bairro Poço da Panela localizado na zona norte do Recife/PE e faz parte de uma Zona Especial de Preservação do Patrimônio Histórico e Cultural (ZEPH). O “Panela do Jazz” tem como foco apresentações musicais de jazz instrumental de artistas pernambucanos e de renome nacional. Paralelamente, acontecem atividades de formação com workshops e masterclass nas áreas de gestão cultural e economia criativa, percepção e criatividade musical e vivências ambientais nas margens do Rio Capibaribe, bem como, uma feirinha com artesanato com materiais recicláveis e gastronomia regional. Os shows e as atividades de formação serão gratuitos, considerando-se como público prioritário, para a área formativa, os alunos da rede pública de ensino.",399654.97,"O projeto consiste na realização de: • Seis (6) shows gratuitos de música instrumental com o foco nos artistas locais (pernambucanos) e atrações renomadas do ramo do Jazz nacional e internacional. Os","Recife","2019-06-28","PE","Todos os locais das apresentações serão ao ar livre e terão lixeiras de coleta seletiva e equipe de limpeza em turnos regulares, além da coleta seletiva de lixo. Haverá ainda a preparação do terreno p","Sendo um evento de caráter abrangente e gratuito, não há distribuição de ingressos, senhas ou convites e todas as seis (6) atrações serão abertas ao público em geral com livre circulação. Ainda assim,",399654.97,"Pro 4 Promoção e Eventos Ltda.","18","2019-03-20",0.0,399654.97
