etapa,providencia,area,enquadramento,objetivos,ficha_tecnica,situacao,outras_fontes,acessibilidade,sinopse,nome,cgccpf,mecanismo,segmento,PRONAC,estrategia_execucao,valor_aprovado,justificativa,resumo,valor_solicitado,especificacao_tecnica,municipio,data_termino,UF,impacto_ambiental,democratizacao,valor_projeto,proponente,ano_projeto,data_inicio,valor_captado,valor_proposta
"etapas de trabalho   Pré-Produção (2 semanas) - Contratação de Assessoria Jurídica; - Contratação de Assessoria Contábil; - Contratação de equipe e assinatura de contratos; - Contratação de pres","Proposta transformada em projeto e encaminhado para assinatura.","Humanidades","Artigo 18","1.0 objetivo geral   “À procura de um tempo lento” trata da produção de um livro de arte com tiragem de 2.000 exemplares e uma exposição de arte em um espaço público na cidade de São Paulo (SP) com","livro À PROCURA DE UM TEMPO LENTO Coordenação Editorial | a definir Edição | Prof. Dr. Cauê Alves (em negociação) Textos |  André Azevedo e Cauê Alves (em negociação) Direção de Arte | a definir","Projeto em avaliação documental",0.0,"A exposição e lançamento do livro serão realizadas em um espaço público ou privado que já atenda as diretrizes da Lei 13.146/2015 (Lei Brasileira de Inclusão da Pessoa com Deficiência (Estatuto da Pes","“À procura do tempo lento” traz um compilado dos estudos do artista curitibano André Azevedo acerca da arte têxtil. Buscando interrelacionar a arte têxtil e a produção textual, o artista parte da etimologia das palavras – do latim “tecer”, texto significa tecido. Apresentando estudos sobre novos procedimentos para a arte têxtil, sua pesquisa envolve a utilização de ferramentas como a máquina de escrever e a máquina de costura. Além de um livro de arte com ensaios textuais e fotográficos sobre a obra de André, o projeto também contempla uma exposição com acesso gratuito, onde o público poderá observar as obras e o processo seu processo de produção através de performances semanais realizadas pelo artista.","À PROCURA DE UM TEMPO LENTO - ANDRÉ AZEVEDO","23522087000162","Mecenato","Livros  ou obras de referência - valor Artístico","186363","Para realização do projeto já foram negociadas a participação do Prof. Dr. Cauê Alves, que já orienta o artista André Azevedo em sua pesquisa sobre arte têxtil. E negocia-se a participação do cordenad",0.0,"“À procura de um tempo lento” trata da produção de um livro de arte e uma exposição de arte homônimos, de autoria do artista André Azevedo. Nascido em Curitiba (PR), participou da primeira exposição c","“Etimologicamente a palavra texto quer dizer tecido, e a palavra linha, um fio de um tecido de linho”. Partindo da afirmação de que texto significa tecido, o projeto “À procura de um tempo lento”, do artista André Azevedo, apresenta um estudo sobre novos procedimentos para a obra de arte têxtil contemporânea, suas relações conceituais e metodológicas. O projeto busca contribuir para a formação de uma sensibilidade e pensamento crítico do público em relação à produção, circulação e acesso à obra de arte têxtil através da produção de um livro de arte e uma exposição homônimos, que refletem sobre o têxtil como linguagem, conceito e materialidade e traz questionamentos a cerca da produção teórica na arte, o papel da pesquisa e reflexões sobre a importância do processo de produção. A exposição contempla perfomances semanais do artista que irá produzir obras complementando espaços inicialmente vazios, compostos de quadros de feltro (ou cortiça) e molduras instaladas sem obras.",251080.8,"livro À PROCURA DE UM TEMPO LENTO (André Azevedo)   ficha técnica número de páginas | 100 páginas tiragem | 2.000 exemplares preço de capa | até R$ 100,00 valor de venda da cota a preço popula","São Paulo","2019-12-14","SP","","Um dos principais objetivos do projeto “À procura de um tempo lento” é democratizar a arte contemporânea, em especial a arte têxtil, através da produção de uma exposição com acesso gratuito e da distr",0.0,"AGENCIA DE IDEIAS PRODUCOES CULTURAIS E EDITORIAIS LTDA - ME","18","2019-03-25",0.0,251080.8
"O projeto será dividido em três etapas, a serem concluídas no prazo de um ano, conforme detalhes abaixo:           PRÉ-PRODUÇÃO - quatro meses   1. Contratação de equipes 2.     Elaboração de con","Proposta transformada em projeto e encaminhado para assinatura.","Humanidades","Artigo 18","Objetivo Geral: Realizar a SEMANA CULTURAL EUCLIDES da CUNHA DE SÃO JOSÉ DO RIO PARDO de forma a tornar mais conhecida das novas gerações, a escrita de um dos principais autores brasileiros, por meio","DIREÇÃO GERAL E FINANCEIRA  NOELLY RUSSO Jornalista, tradutora, roteirista, produtora e escritora, Noelly foi repórter, correspondente internacional, editora e secretária de redação assistente no Jo","Projeto em avaliação documental",0.0,"Produto livro:  Acessibilidade para pessoas com deficiência visual: audescrição da obra no site dedicado do projeto.  Produto Festival:  O evento é montado em área aberta em que há calçadas rebaixa","SEMANA CULTURAL EUCLIDES da CUNHA DE SÃO JOSÉ DO RIO PARDO         Apresentações musicais: Apresentação do Polo do Conservatório de Tatuí de São José do Rio Pardo (repertório brasileiro); Artistas locais: Fernando Junior e Banda e Dino Rock,  Banda Gênese, além de UNIROCK e projeto Samba do Chicão; Apresentação de dança: Apresentação do Espetáculo  de dança Cabaret, com professores e alunos da Escolas de Artes do Município – Fábrica de Expressão; Oficinas culturais: fotografia, poesia e literatura; Palestras e conversas com autores (previsão): Gabriel Chalita, Ignácio de Loyola Brandão, José Renato Nalini e Mauricio de Sousa Feira de livros: convite a editoras, autores, oficinas de escrita e doação de livros a Biblioteca Pública Municipal Monteiro Lobato e às duas escolas em situação de mais vulnerabilidade no município. Oficina voltada aos professores com o tema de incentivo à leitura, voltado para os anos pré-escolares de letramento Doação de 200 exemplares do Livro Euclides da Cunha em 81 Cartazes: Livro ilustrado que traz os cartazes criados para o evento desde sua criação em 1938. A obra recupera e documenta ainda os principais momentos das semanas euclidianas, como fotos dos eventos anteriores, da Casa de Cultura Euclides da Cunha e dos demais marcos culturais e históricos relacionados ao autor.","SEMANA CULTURAL EUCLIDES da CUNHA DE SÃO JOSÉ DO RIO PARDO","08277593000140","Mecenato","Ações educativo-culturais","186362","SITE Semana Euclidiana SINOPSEO site “Semana Euclidiana” reunirá como conteúdo principal as palestras, oficinas, extratos dos shows e apresentações, assim como vídeos que mostrem trechos de desfiles",0.0,"Justifica-se a inscrição da “SEMANA CULTURAL EUCLIDES da CUNHA DE SÃO JOSÉ DO RIO PARDO” na na Lei Rounet pedindo o benefício da isenção fiscal de IR com base na legislação como se segue: Art. 1° Fic","Realização da SEMANA CULTURAL EUCLIDES da CUNHA DE SÃO JOSÉ DO RIO PARDO. O evento, tradicional na região, acontece há mais de um século e conta com a mobilização da comunidade para acontecer. É o evento cultural mais importante da região, mas durante os 80 anos em que foi organizado passou a atrair o interesse e outros Estados, dada a importância e o interesse histórico que Euclides da Cunha desperta. A Semana de Estudos de Euclides da Cunha contará com diversa programação cultural.Estão programadas conferências e palestras que debatem a obra do escritor, além de concurso de dissertações sobre a obra do autor. Durante a semana a cidade recebe shows, exposições, oficinas de gastronomia e feira de livros. O município conta com a Casa de Cultura Euclides da Cunha, onde funciona um museu com todo o acervo do escritor. Será editado livro com cartazes históricos de outras semanas antigas. Euclides da Cunha residiu na cidade,quando escreveu “Os Sertões”.",836139.7,"Livro Euclides da Cunha em 81 Cartazes   O livro trará textos que contextualização a ligação do autor com a cidade de São José do Rio Pardo, onde Euclides da Cunha viveu e escreveu sua principal obr","São Paulo","2019-11-26","SP","","Em atendimeto ao artigo 21, da IN - 5/2017, o propete informa que:  Produto Festival:  O proponente se compromete a oferecer transporte gratuito ao público, prevendo acessibilidade à pessoa com defi",0.0,"Sopa Editora e Produtora Ltda - ME","18","2019-03-11",0.0,836139.7
"1)PRÉ-PRODUÇÃO - Mês 1 e 2 -Ajuste de agendamento com as Escolas -Contratação de Serviços de Sonorização -Contratação do Técnico de Som -Elaboração e Impressão do Material Gráfico (Banners, Cartaz","Portaria de aprovação inicial encaminhada à Imprensa Nacional para publicação no Diário Oficial da União.","Humanidades","Artigo 18","Serão realizadas de forma gratuita, 60 (sessenta) atividades de estímulo e incentivo à leitura e a literatura com o projeto lítero-musical Fernando Para Pessoas, distribuídas em escolas da rede públic","Antonio Marcos Moreira Pinto: exercerá a função de Administrador do Projeto, Produtor Executivo e Músico/Intérprete.  Graduado em Licenciatura em Filosofia pela UNOCHAPECÓ (conclusão em 12/2010) e g","Aguardando publicação de portaria",0.0,"As 60 (sessenta) ações de estímulo e incentivo à leitura e a literatura serão distribuídas em colégios da rede pública de Chapecó/SC. Estima-se que os colégios estejam preparados e já recebendo alunos","O projeto Fernando para Pessoas é concebido na transversalidade artística literatura-música, como uma atividade potencial de estímulo e incentivo a leitura e a literatura, apresentando poesias do escritor português Fernando Pessoa (sua obra é de Domínio Público), em forma musicada. Soma-se ao repertório poético-musical informações bio e bibliográficas, bem como curiosidades de sua controversa vida, intermediadas pelos integrantes do projeto. Para a efetivação de uma prática de leitura, o acompanhamento e a facilitação no entendimento dos textos apresentados, bem como para materializar as poesias-musicadas, serão distribuídos ao público antes das apresentações, livretos com a seleção dos textos apresentados, para fortalecer e estimular os alunos a despertarem interesse pela obra do poeta, pela literatura e pela poesia, bem como vir a somar no desenvolvimento de hábitos da leitura.","Fernando Para Pessoas - Poesia Musicada","***557689**","Mecenato","Ações educativo-culturais","186361","Fernando Para Pessoas:  Midias Sociais: https://www.facebook.com/fernandoparapessoas/   Fotografias: https://www.facebook.com/pg/fernandoparapessoas/photos/?ref=page_internal   Vídeos: Presság",324675.0,"Fernando Para Pessoas é um projeto lítero-musical inspirado na vida e obra de um dos maiores poetas da língua portuguesa: Fernando Pessoa. Dono de vasta obra, múltiplos heterônimos e universos cambian","Realizar gratuitamente, 60 (sessenta) atividades de estímulo e incentivo à leitura e a literatura com o projeto lítero-musical Fernando Para Pessoas, para os alunos matriculados em escolas da rede pública na Cidade de Chapecó/SC.",324675.0,"Mídias Impressas: - 120 (cento e vinte) unidades de Cartaz modelo A3; - 02 (dois) Banners 70 x 140 cm; - 9000 (nove mil) livretos formato A4 com duas dobras   Bens duráveis - 400 (quatrocentas)","Chapecó","2019-12-31","SC","As apresentações serão realizadas em espaços fechados: teatros, salas multiuso e espaços de convivência das Escolas Públicas do município de Chapecó/SC. A sonorização será moderada, trabalhando com vo","A realização das 60 (sessenta) ações de estímulo e incentivo à leitura e a literatura são direcionadas especificamente aos alunos da rede pública de Chapecó/SC, de forma inteiramente gratuíta. Não há",324675.0,"Antonio Marcos Moreira Pinto","18","2019-07-01",0.0,324675.0
"Etapa 1 (Pré-produção): 30 dias   1)      Elaboração estratégica do projeto. 2)      Atualização de planilha orçamentária. 3)      Visitas técnicas ao local de realização do evento. 4)      Entra","Portaria de aprovação inicial encaminhada à Imprensa Nacional para publicação no Diário Oficial da União.","Humanidades","Artigo 26","- Objetivo Geral O BRMC tornou-se um dos cinco mais relevantes eventos setoriais de “Live Entertainment &amp; Music Content” de todo o mundo e o maior na América do Sul, promovendo a cada ano a conv","Gestão do projeto: DFSP - Dream Factory - Proponente ( Parte de custos administrativos) Claudio da Rocha Miranda Filho / Função: Direção Geral de projeto Empresário e criativo da Indústria do Entret","Aguardando publicação de portaria",0.0,"Acessibilidade Fisica: O local selecionado para realização do projeto, Unibes Cultural, conta com acessibilidade conforme abaixo: 3 banheiros acessíveis Rampa para o palco 4 Elevadores Piso Tátil","As diversas atividades do BRMC fazem parte de um dos 6 macro-temas abaixo:   SOMOS Latinoamerica Nos últimos cinco anos, jovens de toda América do Sul abraçaram a música eletrônica e sua cultura, aos milhões. Da Argentina ao México, a Colômbia, o Equador, o Chile e, claro, o Brasil, a música eletrônica cresceu e hoje é o estilo que mais de 100 milhões de millennials da região querem ouvir! Para celebrar isso e encorajar uma aproximação de ecossistemas, o BRMC apresentará uma série de painéis com especialistas regionais que examinam as realidades atuais da cena e questionam como as comunidades criativas da região podem colaborar para fazer da América Latina a verdadeira federação de nações eletrônicas!   Trending Topics Conhecer tendências não é apenas uma opção, mas uma obrigação para os grandes profissionais de qualquer mercado criativo. Portanto é melhor manter os olhos e ouvidos bem abertos aos tópicos recorrentes no mundo atual. Questões de gênero, sexualidade e política estão nos holofotes; influenciadores e personalidades do mundo digital são o grande foco de atenção e investimento. Por outro lado, movimentações culturais genuínas têm mudado o panorama do mercado e quebrado fronteiras na música. Aqui é o espaço para debater iniciativas, movimentos e pessoas que vêm moldando o mundo em que vivemos.     Show Business Apesar de ser o ápice para o público, cada apresentação artística (seja um show ou DJset) é apenas o produto final de uma cadeia produtiva riquíssima, composta por profissionais competentes de diversas áreas do entretenimento, compreendendo clubes, festas e festivais de renome. Muitos destes profissionais aprenderam na prática e contam com anos de mercado, já outros estão iniciando carreiras brilhantes: o ponto em comum entre eles reside nas imensas dificuldades imposta pelo sistema para executar experiências que ficarão para a vida toda. Mas o show tem que continuar!   Art in sound Porque todo cenário cultural se baseia na arte; na necessidade de expressão. Dos subúrbios de Chicago, Detroit e Berlim aos morros cariocas, passando pelas comunidades indígenas ou por caóticas cidades Latino Americanas. Muito além do mercado, a música e o entretenimento são exemplos vivos de cultura, que respira e gravita em torno dos mais variados temas, surgindo e transformando as pessoas que se envolvem com eles. É hora de conhecer cases e personalidades de sucesso nesta cena, que já possuem lugar cativo na história da música eletrônica. Future forum Inovação e futurismo, do empreendedorismo disruptivo à realidade virtual. A tecnologia desempenha um papel importante na vida da maioria das pessoas, agindo como um facilitador para muitos e como fonte de inspiração criativa para os demais. Para ajudar nossos participantes a entender tudo isso, e também a ver algum sentido do que será introduzido na próxima década, o BRMC criou o Future Forum, um lugar onde as melhores ideias novas em produção, música, tecnologia e inovação ocupam um lugar central.     Music+Brands Uma série de painéis, pitches e oficinas que examinam as interações entre artistas e marcas. Dado que o BRMC está agora localizado em São Paulo, é esperada a presença de profissionais de ponta da indústria de publicidade brasileira, convidados a falar sobre como os relacionamentos marca/artista estão evoluindo e a oferecer exemplos de campanhas publicitárias que incluíram contribuição do artista e da marca. Os convidados também oferecerão conselhos para os artistas, falando sobre como eles podem se tornar relevantes e atraentes para as marcas e suas campanhas.","Brazil Music Conference","08411200000149","Mecenato","Treinamento-pessoal, demais ações de capacitação","186360","Os trechos de passagens aéreas não foram definidos em Deslocamento, uma vez que os participantes e palestrantes ainda não foram definidos pela Curadoria, assim como a equipe que terá que se deslocar",1379205.37,"O BRMC desde sempre criou e vem sustentando o movimento que acompanha o grande crescimento do estilo eletrônico no mercado e toda a sua importância que vem conquistando principalmente o mercado do ent","O Brazil Music Conference, também conhecido como BRMC, acontece desde 2009 e é considerado o principal evento de capacitação, formação e negócios da música e do entretenimento ao vivo do continente Latino Americano. Em painéis, discussões, palestras e workshops e aulas são abordados as principais tendências globais, criativas, tecnológicas e mercadológicas para esta grande cadeia produtiva e setores transversais da economia criativa.",1379205.37,"não se aplica","São Paulo","2019-06-28","SP","","O projeto irá respeitar os limites da IN 5/2017 para comercialziação conforme plano de distribuição. A exposição será gratuita, assim como as atividades do BRMC Suave, ampliando assim ainda mais o ac",1379205.37,"DFSP COMUNICAÇÃO E EVENTOS S.A.","18","2019-02-05",0.0,1379205.37
"PRÉ-PRODUÇÃO 01 a 30/06/2019: - Contratação da equipe do projeto 01/07 a 30/08/2019: - Adaptação das peças para carregá-las na plataforma web. 01 a 30/07/2019: - Contratação da empresa que fará","Portaria de aprovação inicial encaminhada à Imprensa Nacional para publicação no Diário Oficial da União.","Humanidades","Artigo 18","Objetivo Geral: - Permitir a contínua transmissão e prática dos conhecimentos sobre o folclore infantil, acerca das tradições do brincar, através da tecnologia e da formação de multiplicadores.   O","Lila Lopes - Diretora executiva responsável pelo planejamento e execução do projeto, além de articulações entre os parceiros e prestação de contas. Com ampla e diversificada rede de relacionamentos,","Aguardando publicação de portaria",0.0,"Para tornar a navegação do site mais acessível utilizaremos como guia para a nova catalogação das peças no site Cirandando Brasil as orientações que o governo brasileiro publicou, o e-MAG (Modelo de A","Acervo Plataforma Web Cirandando Brasil:O Cirandando Brasil é um dos maiores acervos sobre as cantigas e brincadeiras do folclore infantil brasileiro.  O portal resgata, atualiza e devolve a todos nós a cultura da brincadeira brasileira, capaz de garantir que nossas crianças continuem cantando, brincando, sabendo quem somos e de onde viemos.A plataforma reúne cantigas, parlendas, adivinhações, jogos, histórias e ferramentas facilitadoras para transmissão e prática desse conhecimento, construído a partir da compilação de profundos estudos produzidos acerca do tema. A classificação indicativa etária para o conteúdo do site é livre. Formação de MultiplicadoresA formação capacita professores do ensino regular, educadores culturais, sociais e já ocorre há dez anos (até o momento já foram capacitados 30.000 mil educadores) a utilizarem a cultura da brincadeira como estratégia didática e conteúdo transversal. A abrangência do projeto até o momento, diz respeito a Salvador, mais de 150 cidades do interior da Bahia, Ceará (Universidade Estadual do Ceará), São Luis do Maranhão (Universidade Estadual do Maranhão - UEMA), São Paulo (PUC, USP e Secretaria de Educação de Mogi das Cruzes), Sergipe (Educadores Sociais), Pernambuco (Instituto Adolescer), além de Portugal e países lusófonos, Alemanha e França.A Formação de Multiplicadores promove aos participantes uma vivência das brincadeiras do folclore infantil, contação de história da brincadeira, as influências étnicas formadoras da identidade cultural brasileira, a reflexão da brincadeira como estratégia didática e com o conteúdo transversal nos espaços de ensino e aprendizagem. Para a formação é preciso ser maior de 18 anos, e possuir curso médio completo.","Cirandando Brasil","15277804000100","Mecenato","Manut. acervos biblio.artístico, literário, human.","186357","O acervo físico do Cirandando Brasil é composto por 2040 peças do Folclore infantil, resgatadas partiturizadas, contextualizadas do ponto de vista étnico, musical, histórico antropológico. Compõe-se d",952336.44,"Visto que a Lei Ruanet prevê a facilitação, o estímulo e a promoção, para todos às fontes da cultura e o pleno exercício dos direitos culturais, especialmente a regionalização da produção cultur","O projeto tornará acessível para todo e qualquer público mais de 1.000 peças, 700 já existentes e 300 que serão catalogadas, de folclore infantil acerca das tradições do brincar, que foram reunidas durante anos de estudos e pesquisas pela autora Nais Spinelli Lauria, através da catalogação e compilação das peças na plataforma web Cirandando Brasil. Além disso, prevemos também a formação de multiplicadores nas tradições do brincar para que esta memória e patrimônio imaterial sejam salvaguardados, de maneira sistematizada, em benefício de toda humanidade.",952336.44,"Acervo Plataforma Web Cirandando Brasil:Para a catalogação das 300 peças no site estimamos 2 meses de trabalho com uma equipe de 2 profissionais em período integral (8h/dia, 40h/semana). Isso dá uma m","Salvador","2020-05-30","BA","","No escopo do projeto está prevista a formação de multiplicadores especialistas na transmissão e prática dos conhecimentos sobre o folclore infantil, acerca das tradições do brincar, além disso, atravé",952336.44,"AU MARKETING CULTURAL E SOCIAL EIRELI ","18","2019-06-01",0.0,952336.44
"Pré Produção - 60 dias 4) Contratação de Produtores 5) Contratação de equipe técnica 6) Estabelecimento de parcerias com as prefeituras das cidades selecionada 7) Definição dos locais de realização d","Portaria de aprovação inicial encaminhada à Imprensa Nacional para publicação no Diário Oficial da União.","Música","Artigo 18","Objetivo Geral O projeto Move, tem por objetivo, levar a magia da musica instrumental para Curitiba, Florianópolis, Porto Alegre, Salvador, Recife, Goiânia, Brasília, Belo Horizonte e São Paulo. dent","TADEU A BRAMBILLA DE ALMEIDA - DIREÇÃO GERAL (PROPONENTE) Responsável pela Elaboração de Projetos para as Leis de Incentivo à Cultura e Editais de Patrocínio Run &amp; Arts Circuito ao ar Livre O","Aguardando publicação de portaria",0.0,"O projeto Move estará devidamente preparado para o atendimento dos portadores de necessidades especiais, em conformidade com Norma Brasileira15599:2008 da ABNT) Nos espetáculos de sons e imagens real","Neste momento não temos como indicar a sinopse dos filmes que serão exibidos no projeto, até porque, dependemos da aprovação do projeto, captação de recursos para que possamos de fato montar toda a estrutura e por fim desenvolver a programação semanal do projeto.","Move","19106448000112","Mecenato","Música Instrumental","186356","Trata-se de projeto de Música Instrumental ao Ar Livre, não sendo necessário prever nos objetivos, a inclusão de outrás áreas da cultura. Os artistas / musicos serão selecionados após a aprovação do",3602355.0,"Conforme Art. 1º da Lei 8.313/91, o projeto se enquadra na contribuição para facilitar à todos, os meios para o livre acesso às fontes de cultura e o pleno exercício dos direitos culturais. O projeto","O projeto Move, objetiva levar para cidades do Brasil, apresentações de Música instrumental em locais ao ar livre. O Evento será realizado durante os meses de Março a dezembro de 2019.",3602355.0,"não se aplica ao projeto","São Paulo","2019-12-30","SP","Para minimizar o impacto ambiental nos locais onde serão instalados o projeto, disponibilizaremos ao público: a) Parceria com Cooperativa de coleta seletiva para selação do lixo b) Instalaç","Além do previsto no Inciso 1 do Artigo 44 do Decreto 5.761 de 2006, serão doados 30% (trinta por cento) dos ingressos para distribuição gratuita para escolas da rede pública de ensino, instituições",3602355.0,"ACADEMIA INTERNACIONAL DE PRODUCAO LTDA - ME ","18","2019-03-21",0.0,3602355.0
